title,researcher,institution,start_date,project_url
表皮水疱症患者を対象とした他家骨髄間葉系幹細胞製品開発,玉井　克人,国立大学法人　大阪大学,2016-09-16 00:00:00,https://www.amed.go.jp/koubo/01/02/0102C_00036.html
多能性幹細胞由来分化細胞の造腫瘍性試験の評価項目案の策定研究,川真田　伸,公益財団法人　先端医療振興財団,2016-09-16 00:00:00,https://www.amed.go.jp/koubo/01/02/0102C_00036.html
染色体構造異常、造腫瘍性関連遺伝子解析の効率的なパイプラインの構築と、社会実装に向けたゲノム解析標準手法及びゲノム評価基準案の策定に関する研究,森尾　友宏,国立大学法人　東京医科歯科大学,2016-09-16 00:00:00,https://www.amed.go.jp/koubo/01/02/0102C_00036.html
細胞加工製品の造腫瘍性評価に関する多施設共同研究,佐藤　陽治,国立医薬品食品衛生研究所,2016-09-16 00:00:00,https://www.amed.go.jp/koubo/01/02/0102C_00036.html
急性期IoTリストバンド型ウェアラブルデバイス・クラウドスマホアプリシステム医療機器開発研究,髙尾　洋之,学校法人慈恵大学,2016-09-13 00:00:00,https://www.amed.go.jp/koubo/02/02/0202C_00187.html
早く正しい救急医療実現のためのスマートな患者情報収集・処理・共有システムの開発,中田　孝明,国立大学法人千葉大学,2016-09-13 00:00:00,https://www.amed.go.jp/koubo/02/02/0202C_00187.html
QSMとVBMのハイブリッド撮像・解析による認知症の早期診断MRI,工藤　與亮,国立大学法人北海道大学,2016-09-13 00:00:00,https://www.amed.go.jp/koubo/02/01/0201C_00133.html
認知症発症予測・予防介入・徘徊検知支援技術の開発と実用化を目指す研究,松原　悦朗,国立大学法人大分大学,2016-09-13 00:00:00,https://www.amed.go.jp/koubo/02/01/0201C_00133.html
アルツハイマー病の既存髄液バイオマーカーの血液および脳由来エクソソームへの展開とそれらを応用した多項目血液マーカーによる診断システムの実用化,徳田　隆彦,京都府立医科大学,2016-09-12 00:00:00,https://www.amed.go.jp/koubo/01/04/0104C_00093.html
難聴患者における認知機能評価法の新規開発と補聴器装用が影響する認知機能・症状の解明,大森　孝一,京都大学,2016-09-12 00:00:00,https://www.amed.go.jp/koubo/01/04/0104C_00093.html
中高年期障害者の健康増進システムの開発に関する研究,緒方　徹,国立障害者リハビリテーションセンター,2016-09-12 00:00:00,https://www.amed.go.jp/koubo/01/04/0104C_00093.html
多職種協働による地域包括ロービジョンケアシステム開発に関する研究,鈴鴨　よしみ,東北大学,2016-09-12 00:00:00,https://www.amed.go.jp/koubo/01/04/0104C_00093.html
ICTを活用した寡少専門家による地域・在宅ロービジョンケア,仲泊　聡,理化学研究所,2016-09-12 00:00:00,https://www.amed.go.jp/koubo/01/04/0104C_00093.html
外部検証促進のための人材育成,越本 知大,日本実験動物学会,2016-09-12 00:00:00,https://www.amed.go.jp/koubo/04/01/0401C_00075.html
起源を異にするカイコ近交系のゲノムリシークエンシング（2）,嶋田 透,東京大学,2016-09-12 00:00:00,https://www.amed.go.jp/koubo/04/01/0401C_00075.html
代表的なラット系統の全ゲノムリシーケンシングとSNPタイピングキットの開発,須山 幹太,九州大学,2016-09-12 00:00:00,https://www.amed.go.jp/koubo/04/01/0401C_00075.html
1分子リアルタイムDNAシーケンサーによるMSM/Ms系統のリシーケンスと公開,高田 豊行,国立遺伝学研究所,2016-09-12 00:00:00,https://www.amed.go.jp/koubo/04/01/0401C_00075.html
NIESコレクションのシアノバクテリアのゲノム情報整備,広瀬 侑,豊橋技術科学大学,2016-09-12 00:00:00,https://www.amed.go.jp/koubo/04/01/0401C_00075.html
ショウジョウバエ極細胞の凍結保存法の開発,高野 敏行,京都工芸繊維大学,2016-09-12 00:00:00,https://www.amed.go.jp/koubo/04/01/0401C_00075.html
高性能な線虫バランサーの整備,三谷 昌平,東京女子医科大学,2016-09-12 00:00:00,https://www.amed.go.jp/koubo/04/01/0401C_00075.html
ゲノム編集技術を用いた効率的遺伝子ノックイン系統作製システムの開発　,山本 卓,広島大学,2016-09-12 00:00:00,https://www.amed.go.jp/koubo/04/01/0401C_00075.html
ゲノム編集による難治疾患モデル整備のための基盤技術開発,吉木 淳,理化学研究所,2016-09-12 00:00:00,https://www.amed.go.jp/koubo/04/01/0401C_00075.html
国際共同臨床研究実施推進拠点,,国立がん研究センター中央病院 大阪大学医学部附属病院,2016-09-09 00:00:00,https://www.amed.go.jp/koubo/05/01/0501C_00048.html
レセプト等の大規模電子診療情報を活用した薬剤疫学研究を含む医療パフォーマンス評価に関する研究,今村　知明,奈良県立医科大学,2016-09-07 00:00:00,https://www.amed.go.jp/koubo/05/01/0501C_00055.html
患者中心の医療・介護連携システムにおける本人同意とデータ管理に関する調査研究,鈴木　隆弘,千葉大学,2016-09-07 00:00:00,https://www.amed.go.jp/koubo/05/01/0501C_00052.html
PHRにおける本人による同意や、同意に基づくデータ管理のあり方に関する調査研究,滝口　進,株式会社エム・エイチ・アイ,2016-09-07 00:00:00,https://www.amed.go.jp/koubo/05/01/0501C_00052.html
臨床および臨床研究の充実のための本人に関する多種多様な情報のデジタル化・ネットワーク化及び統合的な利活用を可能とする基盤技術に関する研究,阪本　雄一郎,佐賀大学,2016-09-07 00:00:00,https://www.amed.go.jp/koubo/05/01/0501C_00052.html
臨床および臨床研究のための分散PDSの応用に関する研究,橋田　浩一,東京大学大学院,2016-09-07 00:00:00,https://www.amed.go.jp/koubo/05/01/0501C_00052.html
切除不能・術後再発胆道癌に対するFOLFIRINOX療法,伊佐山　浩通,東京大学大学院,2016-09-07 00:00:00,https://www.amed.go.jp/koubo/05/01/0501C_00050.html
経口摂取困難な腹膜播種陽性胃癌症例に対するmFOLFOX6＋パクリタキセル腹腔内投与併用療法の臨床試験,石神　浩徳,東京大学医学部附属病院,2016-09-07 00:00:00,https://www.amed.go.jp/koubo/05/01/0501C_00050.html
産学連携全国がんゲノムスクリーニング（SCRUM-Japan）患者レジストリを活用したHER2陽性の切除不能・再発大腸がんを対象にした医師主導治験,岡本　渉,国立がん研究センター東病院,2016-09-07 00:00:00,https://www.amed.go.jp/koubo/05/01/0501C_00050.html
難治性リンパ管異常に対するシロリムス療法確立のための研究,小関　道夫,岐阜大学医学部附属病院,2016-09-07 00:00:00,https://www.amed.go.jp/koubo/05/01/0501C_00050.html
産学連携全国がんゲノムスクリーニング（SCRUM-Japan）を利用したがん新薬開発に資する疾患登録システムの構築,大津　敦,国立がん研究センター東病院,2016-09-07 00:00:00,https://www.amed.go.jp/koubo/05/01/0501C_00050.html
筋萎縮性側索硬化症患者の疾患登録システムの研究開発,祖父江　元,名古屋大学大学院,2016-09-07 00:00:00,https://www.amed.go.jp/koubo/05/01/0501C_00050.html
難病、希少疾患の医薬品開発におけるクリニカルイノベーションネットワーク構想の推進を目指した疾患登録システム（患者レジストリ）の構築,中村　治雅,国立精神・神経医療研究センター,2016-09-07 00:00:00,https://www.amed.go.jp/koubo/05/01/0501C_00050.html
疾患登録システムの有効活用によるクリニカルイノベーションネットワーク構想の推進方策に関する研究,武田　伸一,国立精神・神経医療研究センター,2016-09-07 00:00:00,https://www.amed.go.jp/koubo/05/01/0501C_00050.html
糖尿病腎症の重症化予防に向けた栄養指導の方法とその効果に関する研究,清野　裕,関西電力株式会社関西電力病院,2016-09-01 00:00:00,https://www.amed.go.jp/koubo/01/05/0105C_00125.html
成人先天性心疾患の遠隔期合併症・問題点の解明とリスク低減への対処法開発に関する研究,建部　俊介,東北大学,2016-09-01 00:00:00,https://www.amed.go.jp/koubo/01/05/0105C_00125.html
成人先天性心疾患の長期予後の視点に基づいた介入のあり方に関する研究,安田　聡,国立循環器病研究センター,2016-09-01 00:00:00,https://www.amed.go.jp/koubo/01/05/0105C_00125.html
マクロファージを標的とした糖尿病網膜症の抗体医薬開発,植村　明嘉,名古屋市立大学,2016-09-01 00:00:00,https://www.amed.go.jp/koubo/01/05/0105C_00125.html
ゲノム病態解析を基軸としたハンナ型間質性膀胱炎の診断精度向上と新規治療法開発に関する研究,秋山　佳之,国立大学法人東京大学,2016-08-29 00:00:00,https://www.amed.go.jp/koubo/01/05/0105C_00119.html
遺伝性徐脈性難病（Kir3.1/3.4 channelopathy）に対するコンパニオン診断の確立および心臓アセチルコリン感受性カリウムチャネル選択的阻害薬による新規治療法開発,朝野　仁裕,国立大学法人大阪大学,2016-08-29 00:00:00,https://www.amed.go.jp/koubo/01/05/0105C_00119.html
原発性免疫不全症の診断困難例に対する新規責任遺伝子の同定と病態解析,岡田　賢,国立大学法人広島大学,2016-08-29 00:00:00,https://www.amed.go.jp/koubo/01/05/0105C_00119.html
致死性疾患肺高血圧症の全く新しい病因蛋白に着目した治療薬開発,佐藤　公雄,国立大学法人東北大学,2016-08-29 00:00:00,https://www.amed.go.jp/koubo/01/05/0105C_00119.html
マルファン症候群における長期多系統障害増悪機構の解明と新規薬物療法開発に向けた研究,武田　憲文,国立大学法人東京大学,2016-08-29 00:00:00,https://www.amed.go.jp/koubo/01/05/0105C_00119.html
創薬を見据えた、ミトコンドリア病の新規病因遺伝子の発見とその病態解明,村山　圭,千葉県がんセンター,2016-08-29 00:00:00,https://www.amed.go.jp/koubo/01/05/0105C_00119.html
MIRAGE症候群の治療法開発に向けた基礎的研究,鳴海　覚志,学校法人慶應義塾大学,2016-08-29 00:00:00,https://www.amed.go.jp/koubo/01/05/0105C_00119.html
医療用免疫不全モデルブタを用いた原発性免疫不全症候群に対する新規治療技術開発に向けた基盤研究,野地　智法,国立大学法人東北大学,2016-08-29 00:00:00,https://www.amed.go.jp/koubo/01/05/0105C_00119.html
神経由来エクソソームを介した多系統萎縮症の発症機序の解明,華山　力成,国立大学法人金沢大学,2016-08-29 00:00:00,https://www.amed.go.jp/koubo/01/05/0105C_00119.html
遺伝学的アプローチによるジストニアの革新的治療法開発,宮本　亮介,国立大学法人徳島大学,2016-08-29 00:00:00,https://www.amed.go.jp/koubo/01/05/0105C_00119.html
チオプリン不耐例を判別するNUDT15 R139C遺伝子多型検査キットの開発を軸とした炎症性腸疾患におけるゲノム医療実用化フレームワークの確立,角田　洋一,東北大学 大学病院,2016-08-22 00:00:00,https://www.amed.go.jp/koubo/04/01/0401C_00076.html
スプライシング操作化合物を対象としたファーマコゲノミクス解析に基づく遺伝性難病治療薬の開発研究,萩原　正敏,京都大学 大学院医学研究科,2016-08-22 00:00:00,https://www.amed.go.jp/koubo/04/01/0401C_00076.html
HER2陽性乳癌に対する手術省略を目指したバイオマーカー開発研究,向井　博文,国立がん研究センター,2016-08-22 00:00:00,https://www.amed.go.jp/koubo/04/01/0401C_00076.html
希少・難治性疾患領域における臨床ゲノムデータストレージの整備に関する研究,小崎 健次郎,慶應義塾大学,2016-08-04 00:00:00,https://www.amed.go.jp/koubo/04/01/0401C_00077.html
希少・難病分野の臨床ゲノム情報統合データベース整備,辻 省次,東京大学,2016-08-04 00:00:00,https://www.amed.go.jp/koubo/04/01/0401C_00077.html
ゲノム創薬・医療を指向した全国規模の進行固形がん、及び、遺伝性腫瘍臨床ゲノムデータストレージの構築,中釜 斉,国立がん研究センター,2016-08-04 00:00:00,https://www.amed.go.jp/koubo/04/01/0401C_00077.html
がん領域における臨床ゲノム情報データストレージの整備に関する研究,堀部 敬三,名古屋医療センター,2016-08-04 00:00:00,https://www.amed.go.jp/koubo/04/01/0401C_00077.html
大規模ゲノム医療体制の確立と知識データベースの構築,間野 博行,東京大学,2016-08-04 00:00:00,https://www.amed.go.jp/koubo/04/01/0401C_00077.html
国内完結型がんクリニカルシークエンスの社会実装と統合データベース構築およびゲノム医療人材育成に関する研究開発,武藤 学,京都大学,2016-08-04 00:00:00,https://www.amed.go.jp/koubo/04/01/0401C_00077.html
ヒトとウイルスのゲノム情報と臨床情報の統合によるHTLV-1関連疾患の診療支援全国ネットワークの確立,松田 文彦,京都大学,2016-08-04 00:00:00,https://www.amed.go.jp/koubo/04/01/0401C_00077.html
B型肝炎に関する統合的臨床ゲノムデータベースの構築を目指す研究,溝上 雅史,国立国際医療研究センター,2016-08-04 00:00:00,https://www.amed.go.jp/koubo/04/01/0401C_00077.html
感覚器障害領域を対象とした統合型臨床ゲノム情報データストレージの構築に関する研究,宇佐美 真一,信州大学,2016-08-04 00:00:00,https://www.amed.go.jp/koubo/04/01/0401C_00077.html
認知症臨床ゲノム情報データベース構築に関する開発研究,森 啓,大阪市立大学,2016-08-04 00:00:00,https://www.amed.go.jp/koubo/04/01/0401C_00077.html
糖尿病の遺伝・環境因子の包括的解析から日本発次世代型精密医療を実現するプロジェクト,門脇　孝,東京大学 大学院医学系研究科,2016-08-01 00:00:00,https://www.amed.go.jp/koubo/04/01/0401C_00078.html
精神・神経疾患治療薬及びがん治療薬におけるファーマコゲノミクス研究,莚田　泰誠,国立研究開発法人 理化学研究所 統合生命医科学研究センター,2016-08-01 00:00:00,https://www.amed.go.jp/koubo/04/01/0401C_00078.html
ヒトゲノムDe Novo情報解析テクノロジーの創出,森下　真一,東京大学 大学院新領域創成科学研究科,2016-08-01 00:00:00,https://www.amed.go.jp/koubo/04/01/0401C_00078.html
多因子疾患の個別化予防・医療を実現するための公開統合ゲノム情報基盤の構築,山本　雅之,東北大学 東北メディカル・メガバンク機構,2016-08-01 00:00:00,https://www.amed.go.jp/koubo/04/01/0401C_00078.html
精神疾患のゲノム医療実現に向けた統合的研究,加藤　忠史,国立研究開発法人 理化学研究所脳科学総合研究センター,2016-08-01 00:00:00,https://www.amed.go.jp/koubo/04/01/0401C_00078.html
日本人大規模全ゲノム情報を基盤とした多因子疾患関連遺伝子の同定を加速する情報解析技術の開発と応用,徳永　勝士,東京大学 大学院医学系研究科,2016-08-01 00:00:00,https://www.amed.go.jp/koubo/04/01/0401C_00078.html
パーキンソン病に対する真の意味のオーダーメイド治療を目指した研究,戸田　達史,神戸大学 大学院医学研究科,2016-08-01 00:00:00,https://www.amed.go.jp/koubo/04/01/0401C_00078.html
先進的シークエンス情報解析技術基盤の開発,藤本　明洋,京都大学 大学院医学研究科,2016-08-01 00:00:00,https://www.amed.go.jp/koubo/04/01/0401C_00078.html
小児医薬品の実用化に資するレギュラトリーサイエンス研究,中村　秀文,国立研究開発機構 国立成育医療センター,2016-08-01 00:00:00,https://www.amed.go.jp/koubo/06/02/0602C_00021.html
腎領域における慢性疾患に関する臨床評価ガイドラインの策定に関する研究,南学　正臣,東京大学 医学部附属病院,2016-08-01 00:00:00,https://www.amed.go.jp/koubo/06/02/0602C_00021.html
医療機器の安全対策充実のためのリスク・ベネフィット評価のフレームワーク構築に関する研究,岩﨑　清隆,早稲田大学理工学術院,2016-08-01 00:00:00,https://www.amed.go.jp/koubo/06/02/0602C_00021.html
本邦の先天異常発生状況の推移とその影響要因に関する研究,平原　史樹,国立病院機構横浜医療センター,2016-07-28 00:00:00,https://www.amed.go.jp/koubo/04/02/0402C_00171.html
高適合・短時間施術を実現する、3Dモデリング及び3D積層造形を応用したカスタムメイド脊柱変形矯正用インプラントの臨床開発,,株式会社ロバート・リード商会,2016-07-12 00:00:00,https://www.amed.go.jp/koubo/020120160114_kettei-old.html
頭蓋内動脈狭窄治療に向けたステント開発,,株式会社Biomedical Solutions,2016-07-12 00:00:00,https://www.amed.go.jp/koubo/020120160114_kettei-old.html
既存の金属製骨折治療デバイスの課題克服を目指した次世代新素材骨折治療デバイスの開発・事業化,,株式会社ビー・アイ・テック,2016-07-12 00:00:00,https://www.amed.go.jp/koubo/020120160114_kettei-old.html
ロコモ対策のための膝痛緩和用医療機器の開発,,パナソニック株式会社アプライアンス社,2016-07-12 00:00:00,https://www.amed.go.jp/koubo/020120160114_kettei-old.html
初期がんに対してリスクが低い放射線治療を短時間で行う（国産）小型高精度放射線治療装置の上市普及によるがん治療における医療費の削減,,株式会社アキュセラ,2016-07-12 00:00:00,https://www.amed.go.jp/koubo/020120160114_kettei-old.html
口腔内環境の変化に対応し、長期予後を確立する歯科用インプラントの開発,,株式会社プラトンジャパン,2016-07-12 00:00:00,https://www.amed.go.jp/koubo/020120160114_kettei-old.html
注射薬・医療材料自動認識装置次世代機の開発,,オオクマ電子株式会社,2016-07-12 00:00:00,https://www.amed.go.jp/koubo/020120160114_kettei-old.html
失明回避に貢献するポータブル視野計（POLS） の開発・事業化,,株式会社 昭和,2016-07-12 00:00:00,https://www.amed.go.jp/koubo/020120160114_kettei-old.html
胎児由来の羊膜再利用によるハイパードライ（HD）羊膜の開発,,株式会社アムノス,2016-07-12 00:00:00,https://www.amed.go.jp/koubo/020120160114_kettei-old.html
線維筋痛症 治療用医療機器の開発及び事業化,,株式会社 P・マインド,2016-07-12 00:00:00,https://www.amed.go.jp/koubo/020120160114_kettei-old.html
数値流体力学による脳動脈瘤血管内治療リスク判定システムの開発,,株式会社根本杏林堂,2016-07-12 00:00:00,https://www.amed.go.jp/koubo/020120160114_kettei-old.html
DDS機能を有する自己組織置換型半月板の開発・実用化,,グンゼ株式会社,2016-07-12 00:00:00,https://www.amed.go.jp/koubo/020120160114_kettei-old.html
1時間以内で個別最適化した手術を完了できる人工関節手術ナビゲーションによる3D手術支援サービスの実用化,,株式会社レキシー,2016-07-12 00:00:00,https://www.amed.go.jp/koubo/020120160114_kettei-old.html
強度近視、遠視、老眼にも適応可能な角膜矯正用コンタクトレンズ,,ロート製薬株式会社,2016-07-12 00:00:00,https://www.amed.go.jp/koubo/020120160114_kettei-old.html
ナノバイオ工学による日本発のグローバルスタンダード人工股関節の開発と海外事業展開,,京セラメディカル株式会社,2016-07-12 00:00:00,https://www.amed.go.jp/koubo/020120160114_kettei-old.html
検査時間の大幅短縮によるFMD検査の普及促進と海外展開,,株式会社ユネクス,2016-07-12 00:00:00,https://www.amed.go.jp/koubo/020120160114_kettei-old.html
医師の負担を減らす双腕型手術支援システムの開発と海外展開,,株式会社 デンソー,2016-07-12 00:00:00,https://www.amed.go.jp/koubo/020120160114_kettei-old.html
重症心不全に対する自己組織再生型心筋　サポートデバイスの開発と実践,,ニプロ株式会社,2016-07-12 00:00:00,https://www.amed.go.jp/koubo/020120160114_kettei-old.html
低侵襲かつ安全性を高めた改良型国産下肢静脈瘤治療用レーザ装置の開発,,株式会社ユニタック,2016-07-12 00:00:00,https://www.amed.go.jp/koubo/020120160114_kettei-old.html
骨片と併用する骨再生補助能力を持つ自己集合性ペプチドゲル骨補填材の開発,,株式会社メニコン,2016-07-12 00:00:00,https://www.amed.go.jp/koubo/020120160114_kettei-old.html
高適合・短時間施術を実現する、3Dモデリング及び3D積層造形を応用したカスタムメイド脊柱変形矯正用インプラントの開発・事業化,,株式会社ロバート・リード商会,2016-07-12 00:00:00,https://www.amed.go.jp/koubo/02/01/0201C_00140.html
頭蓋内動脈狭窄治療に向けたステントの開発・事業化,,株式会社Biomedical Solutions,2016-07-12 00:00:00,https://www.amed.go.jp/koubo/02/01/0201C_00140.html
金属製骨折治療デバイスの課題克服を目指した次世代新素材骨折治療デバイスの開発・事業化,,株式会社ビー・アイ・テック,2016-07-12 00:00:00,https://www.amed.go.jp/koubo/02/01/0201C_00140.html
ロコモ対策のための膝痛緩和用医療機器の開発・事業化,,パナソニック株式会社アプライアンス社,2016-07-12 00:00:00,https://www.amed.go.jp/koubo/02/01/0201C_00140.html
がんに対して低リスク放射線治療を短時間で行う国産小型高精度放射線治療装置の開発・事業化,,株式会社アキュセラ,2016-07-12 00:00:00,https://www.amed.go.jp/koubo/02/01/0201C_00140.html
口腔内環境の変化に対応し、長期予後を確立する歯科用インプラントの開発・事業化,,株式会社プラトンジャパン,2016-07-12 00:00:00,https://www.amed.go.jp/koubo/02/01/0201C_00140.html
注射薬・医療材料自動認識装置次世代機の開発・事業化,,オオクマ電子株式会社,2016-07-12 00:00:00,https://www.amed.go.jp/koubo/02/01/0201C_00140.html
失明回避に貢献するポータブル視野計（POLS） の開発・事業化,,株式会社 昭和,2016-07-12 00:00:00,https://www.amed.go.jp/koubo/02/01/0201C_00140.html
胎児由来の羊膜再利用によるハイパードライ（HD）羊膜の開発・海外展開,,株式会社アムノス,2016-07-12 00:00:00,https://www.amed.go.jp/koubo/02/01/0201C_00140.html
線維筋痛症 治療用医療機器の開発・事業化,,株式会社 P・マインド,2016-07-12 00:00:00,https://www.amed.go.jp/koubo/02/01/0201C_00140.html
数値流体力学による脳動脈瘤血管内治療リスク判定システムの開発・事業化,,株式会社根本杏林堂,2016-07-12 00:00:00,https://www.amed.go.jp/koubo/02/01/0201C_00140.html
DDS機能を有する自己組織置換型半月板の開発・事業化,,グンゼ株式会社,2016-07-12 00:00:00,https://www.amed.go.jp/koubo/02/01/0201C_00140.html
個別最適化した手術を短時間で完了できる人工関節手術ナビゲーションによる3D手術支援サービスシステムの開発・事業化,,株式会社レキシー,2016-07-12 00:00:00,https://www.amed.go.jp/koubo/02/01/0201C_00140.html
強度近視にも適応可能な角膜矯正用コンタクトレンズの開発・事業化,,ロート製薬株式会社,2016-07-12 00:00:00,https://www.amed.go.jp/koubo/02/01/0201C_00140.html
ナノバイオ工学による日本発のグローバルスタンダード人工股関節の開発・海外展開,,京セラメディカル株式会社,2016-07-12 00:00:00,https://www.amed.go.jp/koubo/02/01/0201C_00140.html
検査時間を大幅短縮したFMD検査装置の開発・海外展開,,株式会社ユネクス,2016-07-12 00:00:00,https://www.amed.go.jp/koubo/02/01/0201C_00140.html
医師の負担を減らす双腕型手術支援システムの開発・海外展開,,株式会社 デンソー,2016-07-12 00:00:00,https://www.amed.go.jp/koubo/02/01/0201C_00140.html
低侵襲かつ安全性を高めた改良型国産下肢静脈瘤治療用レーザ装置の開発・事業化,,株式会社ユニタック,2016-07-12 00:00:00,https://www.amed.go.jp/koubo/02/01/0201C_00140.html
骨片と併用する骨再生補助能力を持つ自己集合性ペプチドゲル骨補填材の開発・事業化,,株式会社メニコン,2016-07-12 00:00:00,https://www.amed.go.jp/koubo/02/01/0201C_00140.html
,,株式会社アクティブ・ケア,2016-07-12 00:00:00,https://www.amed.go.jp/koubo/02/01/0201C_00134.html
,,株式会社さくらコミュニティサービス,2016-07-12 00:00:00,https://www.amed.go.jp/koubo/02/01/0201C_00134.html
,,社会福祉法人芳香会,2016-07-12 00:00:00,https://www.amed.go.jp/koubo/02/01/0201C_00134.html
,,株式会社アライブメディケア,2016-07-12 00:00:00,https://www.amed.go.jp/koubo/02/01/0201C_00134.html
,,オリックス･リビング株式会社,2016-07-12 00:00:00,https://www.amed.go.jp/koubo/02/01/0201C_00134.html
