title,researcher,institution,start_date,project_url
神経変性疾患モデルマーモセット開発と新規発生工学技術の開発研究,佐々木 えりか,実験動物中央研究所,2019-05-22 00:00:00,https://www.amed.go.jp/koubo/01/04/0104C_00016.html
脳科学研究に最適な実験動物としてのコモンマーモセット：繁殖・飼育・供給方法に関する研究,和田 圭司,国立精神・神経医療研究センター,2019-05-22 00:00:00,https://www.amed.go.jp/koubo/01/04/0104C_00016.html
体格の良いマーモセットの飼育法の確立と個体の供給,中村 克樹,京都大学,2019-05-22 00:00:00,https://www.amed.go.jp/koubo/01/04/0104C_00016.html
マーモセット研究の支援基盤の構築,佐々木 えりか,実験動物中央研究所,2019-05-22 00:00:00,https://www.amed.go.jp/koubo/01/04/0104C_00016.html
双方向トランスレーショナルアプローチによる精神疾患の脳予測性障害機序に関する研究開発,小池 進介,東京大学,2019-05-22 00:00:00,https://www.amed.go.jp/koubo/01/04/0104C_00016.html
パーキンソン病発症前から発症後に連続する神経回路病態の解明とトランスレータブル指標の開発,高橋 良輔,京都大学,2019-05-22 00:00:00,https://www.amed.go.jp/koubo/01/04/0104C_00016.html
精神疾患モデルマーモセットの自家移植法による作製および解析,饗場 篤,東京大学,2019-05-22 00:00:00,https://www.amed.go.jp/koubo/01/04/0104C_00016.html
神経変性疾患のタンパク凝集・伝播病態と回路障害の分子イメージング研究,樋口 真人,量子科学技術研究開発機構,2019-05-22 00:00:00,https://www.amed.go.jp/koubo/01/04/0104C_00016.html
精神疾患のヒトゲノム変異を基盤とする神経回路・分子病態に関する研究,貝淵 弘三,名古屋大学,2019-05-22 00:00:00,https://www.amed.go.jp/koubo/01/04/0104C_00016.html
アルツハイマー病におけるAβ誘導性タウ凝集病態伝播・神経回路変容機構の解明,富田 泰輔,東京大学,2019-05-22 00:00:00,https://www.amed.go.jp/koubo/01/04/0104C_00016.html
脳ゲノム情報解析による精神疾患関連神経回路の同定と機能解明,岩本 和也,熊本大学,2019-05-22 00:00:00,https://www.amed.go.jp/koubo/01/04/0104C_00016.html
先端レーザー光技術を駆使した高速超解像in vivo3Dイメージング法の研究,根本 知己,北海道大学,2019-05-22 00:00:00,https://www.amed.go.jp/koubo/01/04/0104C_00016.html
細胞内シグナル伝達系の光操作による革新的シナプス可塑性介入技術の研究開発,渡部 文子,東京慈恵会医科大学,2019-05-22 00:00:00,https://www.amed.go.jp/koubo/01/04/0104C_00016.html
活動痕跡の多重化標識と全光学的検索に基づく回路機能解明技術開発,尾藤 晴彦,東京大学,2019-05-22 00:00:00,https://www.amed.go.jp/koubo/01/04/0104C_00016.html
神経動態の多重スケール機能マッピング法の開発,喜多村 和郎,山梨大学,2019-05-22 00:00:00,https://www.amed.go.jp/koubo/01/04/0104C_00016.html
新規ウイルスベクターシステムを用いた霊長類脳への遺伝子導入技術に関する研究開発,高田 昌彦,京都大学,2019-05-22 00:00:00,https://www.amed.go.jp/koubo/01/04/0104C_00016.html
脳深部計測のための音響光技術開発,中川 桂一,東京大学,2019-05-22 00:00:00,https://www.amed.go.jp/koubo/01/04/0104C_00016.html
大脳皮質・皮質下回路機構に迫る多領域間マルチリンク解析法の洗練化,礒村 宜和,玉川大学,2019-05-22 00:00:00,https://www.amed.go.jp/koubo/01/04/0104C_00016.html
神経回路および神経細胞微細構造の相関顕微鏡観察に関する研究開発,平林 祐介,東京大学,2019-05-22 00:00:00,https://www.amed.go.jp/koubo/01/04/0104C_00016.html
遺伝子改変マーモセット作製にかかる革新的胚操作システムの開発,笹岡 俊邦,新潟大学,2019-05-22 00:00:00,https://www.amed.go.jp/koubo/01/04/0104C_00016.html
生体脳深部イメージングの限界を打破する革新的ナノ薄膜の開発,岡村 陽介,東海大学,2019-05-22 00:00:00,https://www.amed.go.jp/koubo/01/04/0104C_00016.html
マーモセットにおける高効率・長遺伝子導入技術の開発,富岡 郁夫,信州大学,2019-05-22 00:00:00,https://www.amed.go.jp/koubo/01/04/0104C_00016.html
革新脳データベースに基づいたデータ駆動型統合モデルの開発,中江 健,京都大学,2019-05-22 00:00:00,https://www.amed.go.jp/koubo/01/04/0104C_00016.html
マーモセット運動野広域高解像度機能マッピング法の開発,蝦名 鉄平,東京大学,2019-05-22 00:00:00,https://www.amed.go.jp/koubo/01/04/0104C_00016.html
ATUM-SEM法を用いた大脳皮質局所神経回路の超微細構造3次元解析の標準化と迅速化,窪田 芳之,生理学研究所,2019-05-22 00:00:00,https://www.amed.go.jp/koubo/01/04/0104C_00016.html
脳状態情報と刺激関連情報の線形結合による脳活動モデリング法の開発,近添 淳一,生理学研究所,2019-05-22 00:00:00,https://www.amed.go.jp/koubo/01/04/0104C_00016.html
ワイヤレス電力伝送システムを用いた新規神経回路光操作法の開発,今吉 格,京都大学,2019-05-22 00:00:00,https://www.amed.go.jp/koubo/01/04/0104C_00016.html
安静時脳波により超早期認知症を検知・識別する人工知能の開発と検証,池田 学,大阪大学,2019-04-26 00:00:00,https://www.amed.go.jp/koubo/01/04/0104C_00017.html
認知症予防を目指した多因子介入によるランダム化比較研究,荒井 秀典,国立長寿医療研究センター,2019-04-26 00:00:00,https://www.amed.go.jp/koubo/01/04/0104C_00017.html
軽度認知症者と家族介護者へのグループ型同時介入プログラムの効果検証,斎藤 民,国立長寿医療研究センター,2019-04-26 00:00:00,https://www.amed.go.jp/koubo/01/04/0104C_00017.html
認知症に対する非薬物療法のエビデンス創出に資するデータ品質一元管理センターの基盤構築と継続的研究支援のための体制整備,平川 晃弘,東京大学,2019-04-26 00:00:00,https://www.amed.go.jp/koubo/01/04/0104C_00017.html
レボドパ誘発ジスキネジアの治療薬の開発,,株式会社三和化学研究所,2019-04-26 00:00:00,https://www.amed.go.jp/koubo/06/01/0601C_00053.html
新規重症筋無力症治療薬の開発（NPO-15),,日本製薬株式会社,2019-04-26 00:00:00,https://www.amed.go.jp/koubo/06/01/0601C_00053.html
網羅的ゲノム解析とインフォマティクス統合解析による認知症の新規病態解析,池内　健,新潟大学,2019-04-19 00:00:00,https://www.amed.go.jp/koubo/01/04/0104C_00013.html
病原性シードの構造生物学的理解に基づくαシヌクレイン伝播分子機構解明,富田　泰輔,東京大学,2019-04-19 00:00:00,https://www.amed.go.jp/koubo/01/04/0104C_00013.html
アポＥ遺伝子型と性差に関わる認知症リスクを低減する食品関連因子の解明,山田　正仁,金沢大学,2019-04-19 00:00:00,https://www.amed.go.jp/koubo/01/04/0104C_00013.html
認知症プレクリニカル期・プロドローマル期を対象とするトライアルレディコホート構築研究,岩坪　威,東京大学,2019-04-19 00:00:00,https://www.amed.go.jp/koubo/01/04/0104C_00013.html
日常生活活動(ADL)の評価指標の互換性と新しいADL指標の開発,大沢　愛子,国立長寿医療研究センター,2019-04-19 00:00:00,https://www.amed.go.jp/koubo/01/04/0104C_00015.html
介護予防のための”通いの場”の総合的研究：実態把握と効果検証,荒井　秀典,国立長寿医療研究センター,2019-04-19 00:00:00,https://www.amed.go.jp/koubo/01/04/0104C_00015.html
地域づくりによる介護予防の推進のための研究,近藤　克則,千葉大学,2019-04-19 00:00:00,https://www.amed.go.jp/koubo/01/04/0104C_00015.html
地域高齢者のエンパワメントによるフレイル予防推進と健康長寿のまちづくり,飯島　勝矢,東京大学,2019-04-19 00:00:00,https://www.amed.go.jp/koubo/01/04/0104C_00015.html
ビックデータを用いた高齢者の死に至る経時的変化の類型化に関する研究,松田　晋哉,産業医科大学,2019-04-19 00:00:00,https://www.amed.go.jp/koubo/01/04/0104C_00015.html
保険レセプトデータを用いた死に至るまでの生活活動能力の経時的変化の類型化とその決定要因の解明,近藤　尚己,東京大学,2019-04-19 00:00:00,https://www.amed.go.jp/koubo/01/04/0104C_00015.html
呼吸不全に対する在宅緩和医療の指針に関する研究,三浦　久幸,国立長寿医療研究センター,2019-04-19 00:00:00,https://www.amed.go.jp/koubo/01/04/0104C_00015.html
高齢腎不全患者に対する腎代替療法の開始/見合わせの意思決定プロセスと最適な緩和医療・ケアの構築,柏原　直樹,川崎医科大学,2019-04-19 00:00:00,https://www.amed.go.jp/koubo/01/04/0104C_00015.html
医生命学系学会の学会員研究倫理素養の均てん化に向けた学修機会の提供,市川 家國,信州大学,2019-04-03 00:00:00,https://www.amed.go.jp/koubo/10/01/1001C_00006.html
倫理審査委員会にかかわる人材育成のための統合的プログラムの開発,江花 有亮,東京医科歯科大学,2019-04-03 00:00:00,https://www.amed.go.jp/koubo/10/01/1001C_00006.html
医療分野における研究倫理教育教材の総合的活用プログラムの開発,松井 健志,国立がん研究センター,2019-04-03 00:00:00,https://www.amed.go.jp/koubo/10/01/1001C_00006.html
臨床研究トレーニングに組み入れ可能な能動的研究倫理学習プログラムの開発,森本 剛,兵庫医科大学,2019-04-03 00:00:00,https://www.amed.go.jp/koubo/10/01/1001C_00006.html
学際的アプローチによる研究倫理教育のモデル評価プログラムの開発と検証,瀬戸山 晃一,京都府立医科大学,2019-04-03 00:00:00,https://www.amed.go.jp/koubo/10/01/1001C_00006.html
研究公正の推進に資する質問紙調査の活用に関する研究,中村 征樹,大阪大学,2019-04-03 00:00:00,https://www.amed.go.jp/koubo/10/01/1001C_00006.html
研究機関の研究支援ガイドラインの構築に関する国際調査研究,野内 玲,信州大学,2019-04-03 00:00:00,https://www.amed.go.jp/koubo/10/01/1001C_00006.html
子宮腺筋症のゲノムおよびトランスクリプトーム解析に基づく発症・進展機序の解明と分子を標的とした診断・治療への応用,廣田　泰,東京大学,2019-04-01 00:00:00,https://www.amed.go.jp/koubo/04/02/0402C_00015.html
更年期障害の早期かつ客観的な診断が可能な新規パッチ式計測シートの研究開発,澤田　健二郎,大阪大学,2019-04-01 00:00:00,https://www.amed.go.jp/koubo/04/02/0402C_00015.html
妊孕能低下予防・妊合併症リスクの低減を目指したプレコンセプション女性に対する包括的支援プログラムの開発,甲賀　かをり,東京大学,2019-04-01 00:00:00,https://www.amed.go.jp/koubo/04/02/0402C_00015.html
女性診療を支援する「AI診断ナビゲーションシステム：WaiSE」の開発,片井　みゆき,東京女子医科大学,2019-04-01 00:00:00,https://www.amed.go.jp/koubo/04/02/0402C_00015.html
新生児低酸素性虚血性脳症の生物学的マーカーの実用化に向けた臨床研究,伊藤　雅之,国立精神・神経研究センター,2019-04-01 00:00:00,https://www.amed.go.jp/koubo/04/02/0402C_00011.html
乳幼児期に発症する疾患・障害の早期発見と予防的支援手法に関する研究開発－視覚障害について,東　範行,国立成育医療研究センター,2019-04-01 00:00:00,https://www.amed.go.jp/koubo/04/02/0402C_00011.html
ADHDまたは慢性疾患を持つ児への成育環境の影響を測定するマルチモーダルMRI神経ネットワーク指標の開発―Child Attachment Interview による愛着分類を用いて,石井　礼花,東京大学,2019-04-01 00:00:00,https://www.amed.go.jp/koubo/04/02/0402C_00011.html
学童・思春期のこころの客観的指標と連携システムの開発,中村　和彦,弘前大学,2019-04-01 00:00:00,https://www.amed.go.jp/koubo/04/02/0402C_00011.html
脳卒中患者の歩行障害改善に寄与するNIRSニューロリハシステムの研究開発,三原 雅史,川崎医科大学,2019-04-01 00:00:00,https://www.amed.go.jp/koubo/01/04/0104C_00012.html
リハビリテーションロボット機器の有用性と運用に関する研究,大高 洋平,藤田医科大学,2019-04-01 00:00:00,https://www.amed.go.jp/koubo/01/04/0104C_00012.html
BMI型環境制御装置「B-assist」の障害・疾患横断的な有用性の検討,中村 仁洋,国立障害者リハビリテーションセンター,2019-04-01 00:00:00,https://www.amed.go.jp/koubo/01/04/0104C_00012.html
各種認識技術を応用した重度運動機能障害者向けICT機器操作環境の構築に関する研究,伊藤 和幸,国立障害者リハビリテーションセンター,2019-04-01 00:00:00,https://www.amed.go.jp/koubo/01/04/0104C_00012.html
脳脊髄液減少症の病態生理と診断法の開発,荒木 信夫,埼玉医科大学,2019-04-01 00:00:00,https://www.amed.go.jp/koubo/01/04/0104C_00012.html
筋痛性脳脊髄炎／慢性疲労症候群（ME/CFS）の血液診断法の開発,佐藤 和貴郎,国立精神・神経医療研究センター,2019-04-01 00:00:00,https://www.amed.go.jp/koubo/01/04/0104C_00012.html
症例登録レジストリを活用した原因診断に基づく難聴の標準的介入手法確立および遠隔指導システム構築に向けた研究,宇佐美 真一,信州大学,2019-04-01 00:00:00,https://www.amed.go.jp/koubo/01/04/0104C_00012.html
中途視覚障害者に対する運動介入がもたらす心理社会的機能の向上と運動支援プログラムの開発,清水 朋美,国立障害者リハビリテーションセンター,2019-04-01 00:00:00,https://www.amed.go.jp/koubo/01/04/0104C_00012.html
精神医療分野における治療の質を評価するQIとその向上をもたらす介入技法の開発と実用性の検証,橋本 亮太,国立精神・神経医療研究センター,2019-04-01 00:00:00,https://www.amed.go.jp/koubo/01/04/0104C_00012.html
認知行動療法の治療最適化ツールと客観的効果判定指標の開発,中川 敦夫,慶應義塾大学,2019-04-01 00:00:00,https://www.amed.go.jp/koubo/01/04/0104C_00012.html
思春期の子供たちの心の健康を守り、精神障害への発展を予防する介入法の開発,古川 壽亮,京都大学,2019-04-01 00:00:00,https://www.amed.go.jp/koubo/01/04/0104C_00012.html
薬物乱用・依存問題等の物質使用障害を抱える女性に対する効果的な地域内支援のあり方に関する研究,松本 俊彦,国立精神・神経医療研究センター,2019-04-01 00:00:00,https://www.amed.go.jp/koubo/01/04/0104C_00012.html
精神科トランスレーショナルリサーチの推進に向けた臨床研究システムの開発,尾崎 紀夫,名古屋大学,2019-04-01 00:00:00,https://www.amed.go.jp/koubo/01/04/0104C_00012.html
発達障害を含む精神疾患の社会機能・QOLをアウトカムとした実薬・プラセボ反応性予測因子の解明,大町 佳永,国立精神・神経医療研究センター,2019-04-01 00:00:00,https://www.amed.go.jp/koubo/01/04/0104C_00012.html
精神障害や発達障害をもつ人のリカバリーへの内発的動機付けに注目した早期支援法の開発,多田 真理子,東京大学,2019-04-01 00:00:00,https://www.amed.go.jp/koubo/01/04/0104C_00012.html
認知機能および主観的体験の改善を通じて社会機能の向上を目指した第2世代抗精神病薬持効性注射剤の用量最適化のエビデンス構築,竹内 啓善,慶應義塾大学,2019-04-01 00:00:00,https://www.amed.go.jp/koubo/01/04/0104C_00012.html
Oryza属に関するゲノム情報整備（イネ）,佐藤　豊,情報システム・研究機構,2019-03-29 00:00:00,https://www.amed.go.jp/koubo/04/01/0401C_00012.html
NBRP・コムギで整備中の東アジアコムギNAM集団親系統のゲノム多型解析（コムギ）,那須田　周平,京都大学,2019-03-29 00:00:00,https://www.amed.go.jp/koubo/04/01/0401C_00012.html
マウス個体で機能するタンパク質分解デグロンシステムの技術開発（実験動物マウス）,相賀　裕美子,情報システム・研究機構,2019-03-29 00:00:00,https://www.amed.go.jp/koubo/04/01/0401C_00012.html
ラット生殖工学基盤技術開発によるリソース保存の効率化と新規利用者の拡大（ラット）,浅野　雅秀,京都大学,2019-03-29 00:00:00,https://www.amed.go.jp/koubo/04/01/0401C_00012.html
特定の細胞の標識および操作を可能にするトランスジェニックフィッシュ系統の開発（ゼブラフィッシュ）,川上　浩一,情報システム・研究機構,2019-03-29 00:00:00,https://www.amed.go.jp/koubo/04/01/0401C_00012.html
パーキンソン病における疾患修飾薬候補の同定とprecision medicineの実現に向けたアカデミアと企業の技術融合による新たな創薬エコシステムの開発,赤松　和土,順天堂大学,2019-03-28 00:00:00,https://www.amed.go.jp/koubo/06/01/0601C_00057.html
精神障害のゲノム変異を起点としたバイオリソースと臨床情報の活用による非競争的フェーズにおける産学連携創薬の基盤構築,尾崎　紀夫,名古屋大学,2019-03-28 00:00:00,https://www.amed.go.jp/koubo/06/01/0601C_00057.html
大規模疾患レジストリとiPS細胞技術を活用した筋萎縮性側索硬化症に対する新規治療薬開発,祖父江　元,名古屋大学,2019-03-28 00:00:00,https://www.amed.go.jp/koubo/06/01/0601C_00057.html
多層オミックス解析による個別化緑内障創薬,中澤　徹,東北大学,2019-03-28 00:00:00,https://www.amed.go.jp/koubo/06/01/0601C_00057.html
シングルセル解析技術を用いた希少難治性神経筋疾患の病態解明と治療法開発,今村 恵子,京都大学,2019-03-26 00:00:00,https://www.amed.go.jp/koubo/01/05/0105C_00013.html
患者特異的iPS細胞を用いた福山型先天性筋ジストロフィーの病態解析と新規治療法開発,吉田 健司,京都大学,2019-03-26 00:00:00,https://www.amed.go.jp/koubo/01/05/0105C_00013.html
脳移行性経皮吸収ペプチドを用いたアルツハイマー病治療薬の前臨床試験,尾内 康臣,浜松医科大学,2019-03-26 00:00:00,https://www.amed.go.jp/koubo/05/01/0501C_00086.html
CRP遺伝子多型解析による食道癌リンパ節転移リスク診断キットの開発,本山 悟,秋田大学,2019-03-26 00:00:00,https://www.amed.go.jp/koubo/05/01/0501C_00086.html
ナノゲル型経鼻肺炎球菌ワクチンの開発,清野 宏,東京大学,2019-03-26 00:00:00,https://www.amed.go.jp/koubo/05/01/0501C_00086.html
気密環境下製造粘膜上皮シートの実用化,星 和人,東京大学,2019-03-26 00:00:00,https://www.amed.go.jp/koubo/05/01/0501C_00086.html
髄液中リゾリン脂質測定の客観的疼痛マーカーとしての臨床検査への導入,矢冨 裕,東京大学,2019-03-26 00:00:00,https://www.amed.go.jp/koubo/05/01/0501C_00086.html
再生組織の強度制御法を用いた臍帯由来人工血管の開発,石川 義弘,横浜市立大学,2019-03-26 00:00:00,https://www.amed.go.jp/koubo/05/01/0501C_00086.html
遺伝性疾患・神経線維腫症2型に対する革新的治療法（新規免疫療法）の開発,戸田 正博,慶應義塾大学,2019-03-26 00:00:00,https://www.amed.go.jp/koubo/05/01/0501C_00086.html
骨腫瘍切除後の再建のためのオーダーメイドインプラントの研究開発,安田 剛敏,富山大学,2019-03-26 00:00:00,https://www.amed.go.jp/koubo/05/01/0501C_00086.html
腸管免疫を利用した新規経口がんワクチンの開発,白川 利朗,神戸大学,2019-03-26 00:00:00,https://www.amed.go.jp/koubo/05/01/0501C_00086.html
CXCL2遺伝子とHVJ-Eの配合による癌免疫遺伝子治療剤の創出を目指した研究,金田 安史,大阪大学,2019-03-26 00:00:00,https://www.amed.go.jp/koubo/05/01/0501C_00086.html
神経難病GM2ガングリオシドーシスの遺伝子治療法開発,伊藤 孝司,徳島大学,2019-03-26 00:00:00,https://www.amed.go.jp/koubo/05/01/0501C_00086.html
抗重症熱性血小板減少症候群（SFTS）薬としての新規アモジアキン誘導体の開発研究,馬場 昌範,鹿児島大学,2019-03-26 00:00:00,https://www.amed.go.jp/koubo/05/01/0501C_00086.html
網膜色素変性症に対する経強膜ウノプロストン徐放製剤を用いた安全性及び有効性評価のためのⅠ/Ⅱa相試験,阿部 俊明,東北大学,2019-03-26 00:00:00,https://www.amed.go.jp/koubo/05/01/0501C_00086.html
胸部食道癌患者の放射線障害に対する、ニカラベンの無作為化第II相臨床試験（医師主導治験）,神宮 啓一,東北大学,2019-03-26 00:00:00,https://www.amed.go.jp/koubo/05/01/0501C_00086.html
血管免疫芽球性T細胞リンパ腫（AITL）及びその他の濾胞性ヘルパーT細胞リンパ腫に対するダサチニブの多施設第II相医師主導治験,千葉 滋,筑波大学,2019-03-26 00:00:00,https://www.amed.go.jp/koubo/05/01/0501C_00086.html
軟骨と粘膜上皮の複合再建を実現する再生気管軟骨の臨床展開,星 和人,東京大学,2019-03-26 00:00:00,https://www.amed.go.jp/koubo/05/01/0501C_00086.html
デュシェンヌ型筋ジストロフィーに対する新規配列連結型核酸医薬品の医師主導治験,青木 吉嗣,国立精神・神経医療研究センター,2019-03-26 00:00:00,https://www.amed.go.jp/koubo/05/01/0501C_00086.html
非切除膵癌を対象とした腫瘍溶解性ウイルスの腫瘍内局所投与療法の有効性と安全性に関する医師主導治験,井戸 章雄,鹿児島大学,2019-03-26 00:00:00,https://www.amed.go.jp/koubo/05/01/0501C_00086.html
ワイヤレス体内埋込型ブレイン・マシン・インターフェースによる運動機能・意思伝達機能再建装置の臨床試験,平田 雅之,大阪大学,2019-03-26 00:00:00,https://www.amed.go.jp/koubo/05/01/0501C_00086.html
遺伝子治療製品「Ad-SGE-REIC」の再発悪性神経膠腫対象第I/IIa相試験,伊達 勲,岡山大学,2019-03-26 00:00:00,https://www.amed.go.jp/koubo/05/01/0501C_00086.html
次世代シークエンス技術を用いたC型肝炎の直接作用型抗ウイルス薬による治療後病態に影響をおよぼす因子に関する研究,榎本 信幸,山梨大学,2019-03-22 00:00:00,https://www.amed.go.jp/koubo/01/06/0106C_00010.html
C型肝炎の直接作用型抗ウイルス薬による治療後の病態変化に影響を及ぼす宿主因子等の同定を目指したゲノムワイド研究,田中 靖人,名古屋市立大学,2019-03-22 00:00:00,https://www.amed.go.jp/koubo/01/06/0106C_00010.html
C型慢性肝炎からの肝発がんを予防する研究,金子 周一,金沢大学,2019-03-22 00:00:00,https://www.amed.go.jp/koubo/01/06/0106C_00010.html
リコンビナントCytoglobinを用いた脱肝線維化治療薬開発に関する研究,河田 則文,大阪市立大学,2019-03-22 00:00:00,https://www.amed.go.jp/koubo/01/06/0106C_00010.html
多機能幹細胞を用いた免疫賦活化療法による新規肝炎/肝癌治療の開発研究,大段 秀樹,広島大学,2019-03-22 00:00:00,https://www.amed.go.jp/koubo/01/06/0106C_00010.html
細胞性自然免疫応答賦活によるC型肝炎における肝発がん予防法の開発,加藤 直也,千葉大学,2019-03-22 00:00:00,https://www.amed.go.jp/koubo/01/06/0106C_00010.html
肝炎ウイルスの感染複製増殖と病原性発現を阻止するための基盤的研究とその応用のための基盤的開発,村松 正道,国立感染症研究所,2019-03-22 00:00:00,https://www.amed.go.jp/koubo/01/06/0106C_00010.html
Ｂ型肝炎に関する病態生理の新たな解明に基づく制御法開発,大塚 基之,東京大学,2019-03-22 00:00:00,https://www.amed.go.jp/koubo/01/06/0106C_00010.html
肝炎ウイルスの病原性発現を阻止する新しい治療法開発に資する研究,岡本 徹,大阪大学,2019-03-22 00:00:00,https://www.amed.go.jp/koubo/01/06/0106C_00010.html
B型肝炎ウイルスおよびヒトゲノムの解析に基づくクリニカルシークエンスに向けた研究,徳永 勝士,東京大学,2019-03-22 00:00:00,https://www.amed.go.jp/koubo/01/06/0106C_00010.html
Functional cureを可能とするHBVに対する免疫学的治療戦略の構築,山本 拓也,医薬基盤・健康・栄養研究所,2019-03-22 00:00:00,https://www.amed.go.jp/koubo/01/06/0106C_00010.html
C型肝炎ウイルス排除治療による肝硬変患者のアウトカムに関する研究開発,竹原 徹郎,大阪大学,2019-03-22 00:00:00,https://www.amed.go.jp/koubo/01/06/0106C_00010.html
NASHから肝硬変・肝癌へと至る過程における脂肪沈着減少（burned-out NASH）の意義解明とそれに基づく新規治療戦略,中川 勇人,東京大学,2019-03-22 00:00:00,https://www.amed.go.jp/koubo/01/06/0106C_00010.html
ヒトiPS細胞誘導性肝オルガノイドを用いた革新的疾患モデルの開発および肝線維化と発がんを抑止する治療法の創成,朝比奈 靖浩,東京医科歯科大学,2019-03-22 00:00:00,https://www.amed.go.jp/koubo/01/06/0106C_00010.html
