title,researcher,institution,start_date,project_url
T細胞エクソソームによるがん転移阻害剤,珠玖　洋,三重大学,2017-09-20 00:00:00,https://www.amed.go.jp/koubo/02/02/0202C_00104.html
敗血症治療のためのHRG血液製剤の創出,西堀　正洋,岡山大学,2017-09-20 00:00:00,https://www.amed.go.jp/koubo/02/02/0202C_00104.html
心不全治療を変革する多機能血行動態モニタ,安藤　眞一,九州大学,2017-09-20 00:00:00,https://www.amed.go.jp/koubo/02/02/0202C_00104.html
脱気変形肺に対応した微小結節の術中同定法,伊達　洋至,京都大学,2017-09-20 00:00:00,https://www.amed.go.jp/koubo/02/02/0202C_00104.html
革新的設計による次世代癒着防止材の開発,長谷川　潔,東京大学,2017-09-20 00:00:00,https://www.amed.go.jp/koubo/02/02/0202C_00104.html
難治性肺癌に対する革新的抗がん剤の創出,上久保　靖彦,京都大学,2017-09-20 00:00:00,https://www.amed.go.jp/koubo/02/02/0202C_00104.html
他家再生キラーT細胞の量産技術の開発,河本　宏,京都大学,2017-09-20 00:00:00,https://www.amed.go.jp/koubo/02/02/0202C_00104.html
ロタウイルス人工合成法による新規予防戦略,小林　剛,大阪大学 ,2017-09-20 00:00:00,https://www.amed.go.jp/koubo/02/02/0202C_00104.html
免疫調節薬の創出を目指した研究,高井　俊行,東北大学,2017-09-20 00:00:00,https://www.amed.go.jp/koubo/02/02/0202C_00104.html
TLR7を標的にしたSLE治療薬の開発,長井　良憲,富山大学,2017-09-20 00:00:00,https://www.amed.go.jp/koubo/02/02/0202C_00104.html
転写共役因子TAZ活性化による筋萎縮治療,畑　裕,東京医科歯科大学,2017-09-20 00:00:00,https://www.amed.go.jp/koubo/02/02/0202C_00104.html
老視を治す眼内レンズを実用化する研究開発,飽浦淳介,宮崎大学,2017-09-20 00:00:00,https://www.amed.go.jp/koubo/02/02/0202C_00104.html
組織再生自己硬化型細胞遮断膜の創製,石川邦夫,九州大学,2017-09-20 00:00:00,https://www.amed.go.jp/koubo/02/02/0202C_00104.html
EPRによる抗体イメージング法の開発,井上豪,大阪大学,2017-09-20 00:00:00,https://www.amed.go.jp/koubo/02/02/0202C_00104.html
革新的Mg合金製の生体吸収性医療機器開発,河村能人,熊本大学,2017-09-20 00:00:00,https://www.amed.go.jp/koubo/02/02/0202C_00104.html
透析医療用CPP吸着カラムの開発,黒尾誠,自治医科大学,2017-09-20 00:00:00,https://www.amed.go.jp/koubo/02/02/0202C_00104.html
リゾリン脂質メディエーター研究の医療応用,青木　淳賢,東北大学大学院薬学研究科,2017-09-19 00:00:00,https://www.amed.go.jp/koubo/01/07/0107C_00209.html
個体・臓器老化研究拠点,片桐　秀樹,東北大学　大学院医学系研究科,2017-09-19 00:00:00,https://www.amed.go.jp/koubo/04/02/0402C_00181.html
老化機構・制御研究拠点,原　英二,大阪大学　微生物病研究所,2017-09-19 00:00:00,https://www.amed.go.jp/koubo/04/02/0402C_00181.html
老化研究推進・支援拠点,鍋島　陽一,公益財団法人先端医療振興財団　先端医療センター,2017-09-19 00:00:00,https://www.amed.go.jp/koubo/04/02/0402C_00181.html
膵がん微小環境における免疫抑制ネットワーク機構の解明に基づく新規免役療法の開発,青木　一教,国立研究開発法人国立がん研究センタ,2017-09-15 00:00:00,https://www.amed.go.jp/koubo/01/03/0103C_00084.html
スキルス胃がんにおける変異型RHOAに対する創薬ポイントの確立,油谷　浩幸,国立大学法人東京大学,2017-09-15 00:00:00,https://www.amed.go.jp/koubo/01/03/0103C_00084.html
難治性がんにおけるペプチドミクス解析によるネオアンチゲン同定法の確立と個別化がん免疫療法への応用,笹田　哲朗,地方独立行政法人神奈川県立病院機構　神奈川県立がんセンター,2017-09-15 00:00:00,https://www.amed.go.jp/koubo/01/03/0103C_00084.html
膵臓がんの治療抵抗性を規定する因子の探索と根治を目指した新規治療法の開発,藤田　恭之,国立大学法人北海道大学,2017-09-15 00:00:00,https://www.amed.go.jp/koubo/01/03/0103C_00084.html
HPVワクチンの有効性の評価のための大規模疫学研究,榎本　隆之,国立大学法人新潟大学,2017-09-15 00:00:00,https://www.amed.go.jp/koubo/01/03/0103C_00084.html
成人T細胞白血病に対するHTLV-1ウイルス標的樹状細胞ワクチン療法の確立および製品化技術開発,末廣　陽子,独立行政法人国立病院機構九州がんセンター,2017-09-15 00:00:00,https://www.amed.go.jp/koubo/01/03/0103C_00084.html
難治性消化器がんに対する核酸医療の臨床への展開,森　正樹,国立大学法人大阪大学,2017-09-15 00:00:00,https://www.amed.go.jp/koubo/01/03/0103C_00084.html
日本発放射性薬剤64Cu-ATSMによる悪性脳腫瘍の革新的治療法開発－非臨床毒性試験・次相に向けた薬剤製造体制強化,吉井　幸恵,国立研究開発法人量子科学技術研究開発機構　放射線医学総合研究所,2017-09-15 00:00:00,https://www.amed.go.jp/koubo/01/03/0103C_00084.html
支持／緩和治療領域研究の方法論確立に関する研究,全田　貞幹,国立研究開発法人国立がん研究センター,2017-09-15 00:00:00,https://www.amed.go.jp/koubo/01/03/0103C_00084.html
甲状腺未分化癌の標準的治療法の開発に向けた全国的組織を用いた医師主導臨床試験の企画,小野田　尚佳,公立大学法人大阪市立大学,2017-09-15 00:00:00,https://www.amed.go.jp/koubo/01/03/0103C_00084.html
小児再発・難治性白血病に対する低用量抗胸腺細胞免疫グロブリンを用いたT細胞充満HLAハプロ移植の多施設共同非盲検無対照試験,菊田　敦,公立大学法人福島県立医科大学,2017-09-15 00:00:00,https://www.amed.go.jp/koubo/01/03/0103C_00084.html
標準治療開発を前提とした小児腎腫瘍に対する新規リスク分類確立のための国際共同臨床研究プロトコール作成,越永　從道,学校法人日本大学,2017-09-15 00:00:00,https://www.amed.go.jp/koubo/01/03/0103C_00084.html
悪性胸膜中皮腫に対する血管新生阻害剤の効果予測モデル構築に基づく新治療法確立に関する研究,長谷川　好規,国立大学法人名古屋大学,2017-09-15 00:00:00,https://www.amed.go.jp/koubo/01/03/0103C_00084.html
乳児期発症の急性リンパ性白血病に対する国際共同第III相臨床試験に向けた多施設共同パイロット第II相臨床試験の作成研究,宮村　能子,国立大学法人大阪大学,2017-09-15 00:00:00,https://www.amed.go.jp/koubo/01/03/0103C_00084.html
「一過性骨髄異常増殖症（TAM）に対する化学療法および白血病発症予防法の確立を目指した第2相臨床試験」開発を目指した臨床試験立案研究,村松　秀城,国立大学法人名古屋大学,2017-09-15 00:00:00,https://www.amed.go.jp/koubo/01/03/0103C_00084.html
「新規診断小児急性前骨髄球性白血病における化学療法剤減量を目指した第2相国際共同臨床試験」開発のための臨床試験立案研究,湯坐　有希,東京都立小児総合医療センター,2017-09-15 00:00:00,https://www.amed.go.jp/koubo/01/03/0103C_00084.html
がん微小環境の分子基盤に基づいた革新的がん治療薬の開発,大澤　毅,国立大学法人東京大学,2017-09-15 00:00:00,https://www.amed.go.jp/koubo/01/03/0103C_00084.html
クロマチンリモデリング遺伝子欠損がんにおける代謝経路を標的とした合成致死治療法の開発,荻原　秀明,国立研究開発法人国立がん研究センター,2017-09-15 00:00:00,https://www.amed.go.jp/koubo/01/03/0103C_00084.html
MYCを制御し肺がんの生存・増殖を担うMYMLR lncRNAの機能解明と革新的分子標的薬の開発,梶野　泰祐,国立大学法人名古屋大学,2017-09-15 00:00:00,https://www.amed.go.jp/koubo/01/03/0103C_00084.html
がん特異的抗原の効率的な同定とそれらを標的とした免疫治療戦略の開発,清谷　一馬,公益財団法人がん研究会,2017-09-15 00:00:00,https://www.amed.go.jp/koubo/01/03/0103C_00084.html
がん悪性化に寄与する細胞外小胞顆粒の分泌制御因子を標的とした治療薬の開発,小坂　展慶,国立研究開発法人国立がん研究センター,2017-09-15 00:00:00,https://www.amed.go.jp/koubo/01/03/0103C_00084.html
血管免疫芽球性T細胞リンパ腫における多段階的ゲノム異常を有する腫瘍細胞と微小環境細胞の分子基盤と臨床的特性の解明,坂田（柳元） 麻実子,国立大学法人筑波大学,2017-09-15 00:00:00,https://www.amed.go.jp/koubo/01/03/0103C_00084.html
がん患者血清を用いた自己抗体プロファイリングによる診断マーカーの探索,谷川　千津,国立大学法人東京大学,2017-09-15 00:00:00,https://www.amed.go.jp/koubo/01/03/0103C_00084.html
合成致死表現型を指標とした新規悪性中皮腫治療薬標的の探索,村上（渡並） 優子,愛知県がんセンター,2017-09-15 00:00:00,https://www.amed.go.jp/koubo/01/03/0103C_00084.html
がんと糖尿病：両者を繋ぐメカニズム、糖尿病併存がん患者の実態に関する包括的な疫学研究,後藤　温,国立研究開発法人国立がん研究センター,2017-09-15 00:00:00,https://www.amed.go.jp/koubo/01/03/0103C_00084.html
リアルタイム組織イメージングが可能な共焦点レーザー顕微内視鏡を用いたオプティカルバイオプシーの臨床応用と適応拡大,高丸　博之,国立研究開発法人国立がん研究センター,2017-09-15 00:00:00,https://www.amed.go.jp/koubo/01/03/0103C_00084.html
イノベーションエンジンユニット,池浦　義典,アクセリード ドラッグディスカバリーパートナーズ株式会社,2017-09-13 00:00:00,https://www.amed.go.jp/koubo/06/01/0601C_00010.html
イノベーティブ創薬支援ユニット,長村　文孝,国立大学法人東京大学医科学研究所,2017-09-13 00:00:00,https://www.amed.go.jp/koubo/06/01/0601C_00010.html
エコシステムユニット,吉川　徹,大阪商工会議所,2017-09-13 00:00:00,https://www.amed.go.jp/koubo/06/01/0601C_00010.html
キャタリストユニット,堀　正敏,国立大学法人東京大学大学院農学生命科学研究科,2017-09-13 00:00:00,https://www.amed.go.jp/koubo/06/01/0601C_00010.html
スタートアップユニット,伊藤　毅,Beyond Next Ventures株式会社,2017-09-13 00:00:00,https://www.amed.go.jp/koubo/06/01/0601C_00010.html
バイオ製造支援ユニット,巌倉　正寛,次世代バイオ医薬品製造技術研究組合,2017-09-13 00:00:00,https://www.amed.go.jp/koubo/06/01/0601C_00010.html
プロモーターユニット,井上　裕章,株式会社LSIメディエンス,2017-09-13 00:00:00,https://www.amed.go.jp/koubo/06/01/0601C_00010.html
日本産愛玩由来JF1/Ms系統の高精細ゲノム情報整備,高田　豊行,国立遺伝学研究所,2017-09-08 00:00:00,https://www.amed.go.jp/koubo/04/01/0401C_00068.html
日本産コムギ標準品質のゲノム解析によるコムギ多様性情報の整備,那須田　周平,京都大学,2017-09-08 00:00:00,https://www.amed.go.jp/koubo/04/01/0401C_00068.html
系統保存の高信頼化の復元を可能にする基盤技術整備,近藤　周,国立遺伝学研究所,2017-09-08 00:00:00,https://www.amed.go.jp/koubo/04/01/0401C_00068.html
野生イネ遺伝資源へのゲノム編集技術適用のための基盤技術整備,佐藤　豊,国立遺伝学研究所,2017-09-08 00:00:00,https://www.amed.go.jp/koubo/04/01/0401C_00068.html
ゾウリムシ属の凍結保存技術の開発,藤島　政博,山口大学,2017-09-08 00:00:00,https://www.amed.go.jp/koubo/04/01/0401C_00068.html
次世代眼科医療を目指す、ICT／人工知能を活用した画像等データベースの基盤構築,大鹿　哲郎,筑波大学医学医療系眼科,2017-09-07 00:00:00,https://www.amed.go.jp/koubo/05/01/0501C_00025.html
がん遺伝子診断パネルを用いた先進医療試験計画・実施支援体制の構築,中釜 斉,国立がん研究センター東病院,2017-08-24 00:00:00,https://www.amed.go.jp/koubo/05/01/0501C_00029.html
遺伝子パネル検査を用いたゲノム医療実用化のための先進医療実施支援体制の構築,五神 真,東京大学医学部附属病院,2017-08-24 00:00:00,https://www.amed.go.jp/koubo/05/01/0501C_00029.html
ゲノム医療の実用化を目指した遺伝子パネル検査を含めた先進医療等の計画・実施に係る相談支援・連携体制の構築,中釜 斉,国立がん研究センター中央病院,2017-08-24 00:00:00,https://www.amed.go.jp/koubo/05/01/0501C_00029.html
Precision Cancer Medicineの医療実装を目指した研究支援体制構築のモデル事業,稲垣 暢也,京都大学医学部附属病院,2017-08-24 00:00:00,https://www.amed.go.jp/koubo/05/01/0501C_00029.html
遺伝子パネル検査を含む汎用性が高い医療技術の先進医療による実用化促進を目指した試験計画作成・支援体制の構築,野口 眞三郎,大阪大学医学部附属病院,2017-08-24 00:00:00,https://www.amed.go.jp/koubo/05/01/0501C_00029.html
精密がん医療等の先進医療迅速化スキーム構築,久保 千春,九州大学病院,2017-08-24 00:00:00,https://www.amed.go.jp/koubo/05/01/0501C_00029.html
IoT活用による糖尿病重症化予防法の開発を目指した研究,植木 浩二郎,国立国際医療研究センター 糖尿病研究センター,2017-08-23 00:00:00,https://www.amed.go.jp/koubo/05/01/0501C_00033.html
”噛む”を測ることによるヘルスプロモーションシステムの開発に関する研究,小野 高裕,新潟大学大学院 医歯学総合研究科,2017-08-23 00:00:00,https://www.amed.go.jp/koubo/05/01/0501C_00033.html
IoTを用いた運動行動変容のためのプログラム開発：フレイルの観点から,熊谷 秋三,九州大学 基幹教育院,2017-08-23 00:00:00,https://www.amed.go.jp/koubo/05/01/0501C_00033.html
健康寿命延伸を目的とした加速度センサー利用の効果検証とAIを用いた要介護・認知症発症予測モデルの開発研究,島田 裕之,国立長寿医療研究センター 予防老年学研究部,2017-08-23 00:00:00,https://www.amed.go.jp/koubo/05/01/0501C_00033.html
IoTを基軸とした民・官・学連携による実効性の高い生活習慣病予防・改善モデルの開発,田原 康玄,京都大学大学院 医学研究科附属ゲノム医学センター,2017-08-23 00:00:00,https://www.amed.go.jp/koubo/05/01/0501C_00033.html
IoTを活用した大規模個別運動処方のための携帯端末アプリの開発,増木 静江,信州大学大学院 医学系研究科,2017-08-23 00:00:00,https://www.amed.go.jp/koubo/05/01/0501C_00033.html
小児領域における新薬開発促進のための医薬品選定等に関する研究,高橋　孝雄,公益社団法人日本小児科学会,2017-08-23 00:00:00,https://www.amed.go.jp/koubo/05/01/0501C_00027.html
クライオ電子顕微鏡法による生体分子構造解析の高分解能化と効率化を目指した研究,難波　啓一,大阪大学,2017-08-09 00:00:00,https://www.amed.go.jp/koubo/06/01/0601C_00026.html
クライオ電子顕微鏡によるタンパク質等構造解析―最高の支援体制の構築,Bruno Humbel,沖縄科学技術大学院大学,2017-08-09 00:00:00,https://www.amed.go.jp/koubo/06/01/0601C_00026.html
クライオ電子顕微鏡を用いた膜タンパク質の高分解能動的構造解析と技術人材育成支援,谷　一寿,名古屋大学,2017-08-09 00:00:00,https://www.amed.go.jp/koubo/06/01/0601C_00026.html
クライオ電顕による細胞内ネイティブ複合体構造解析,吉川　雅英,東京大学,2017-08-09 00:00:00,https://www.amed.go.jp/koubo/06/01/0601C_00026.html
ゲノム編集等の技術を用いた疾患モデルマウスの作製とゲノムエンジニアリング技術の開発,中山　学,かずさDNA研究所,2017-08-09 00:00:00,https://www.amed.go.jp/koubo/06/01/0601C_00026.html
次世代型疾患モデル動物作出,畑田　出穂,群馬大学,2017-08-09 00:00:00,https://www.amed.go.jp/koubo/06/01/0601C_00026.html
特殊ペプチド原薬CMO創設,,ペプチドリーム株式会社,2017-08-01 00:00:00,https://www.amed.go.jp/koubo/07/01/0701C_00041.html
経口コメ型バイオ医薬品のプラットフォーム化を目指した実証研究,,アステラス製薬株式会社,2017-08-01 00:00:00,https://www.amed.go.jp/koubo/07/01/0701C_00041.html
産医連携拠点による新たな認知症の創薬標的創出,,エーザイ株式会社,2017-08-01 00:00:00,https://www.amed.go.jp/koubo/07/01/0701C_00041.html
進行性骨化性線維異形成症（FOP）に対する革新的治療薬の創出,,第一三共株式会社,2017-08-01 00:00:00,https://www.amed.go.jp/koubo/07/01/0701C_00041.html
薬剤耐性（AMR）菌感染症治療薬を目的とした創薬研究,,大日本住友製薬株式会社,2017-08-01 00:00:00,https://www.amed.go.jp/koubo/07/01/0701C_00041.html
マラリアワクチンの医薬品開発と商業製造の確立,,ノーベルファーマ株式会社,2017-08-01 00:00:00,https://www.amed.go.jp/koubo/07/01/0701C_00041.html
新規核酸送達技術を用いたウイルス感染症遺伝子ワクチン開発,,第一三共株式会社,2017-08-01 00:00:00,https://www.amed.go.jp/koubo/07/01/0701C_00041.html
立体構造情報を活用した高病原性ウイルスの蛋白質機能探索,五十嵐　学,北海道大学,2017-07-27 00:00:00,https://www.amed.go.jp/koubo/01/06/0106C_00162.html
抗体遺伝子レパトア解析によるSFTS発症機構の探索,鈴木　忠樹,国立感染症研究所,2017-07-27 00:00:00,https://www.amed.go.jp/koubo/01/06/0106C_00162.html
ラッサウイルスの細胞内増殖機構に関する研究,野田　岳志,京都大学,2017-07-27 00:00:00,https://www.amed.go.jp/koubo/01/06/0106C_00162.html
ペア型レセプターを標的にした新たな感染症制御法の開発,荒瀬　尚,大阪大学,2017-07-27 00:00:00,https://www.amed.go.jp/koubo/01/06/0106C_00162.html
オミックス解析を用いたパラミクソウイルス感染における宿主-ウイルス相互作用の解明,加藤　大志,国立感染症研究所,2017-07-27 00:00:00,https://www.amed.go.jp/koubo/01/06/0106C_00162.html
HIV感染症の新規治療コンセプトの確立を目指したシステムウイルス学研究の創出,佐藤　佳,京都大学,2017-07-27 00:00:00,https://www.amed.go.jp/koubo/01/06/0106C_00162.html
インフルエンザウイルス感染に続発する細菌性肺炎の重症化に寄与する宿主・細菌因子群の探索と新規感染制御法の開発,住友　倫子,大阪大学,2017-07-27 00:00:00,https://www.amed.go.jp/koubo/01/06/0106C_00162.html
薬剤耐性RNAウイルス出現予測法の確立と迅速制御のためのインシリコ創薬,西田　教行,長崎大学,2017-07-27 00:00:00,https://www.amed.go.jp/koubo/01/06/0106C_00162.html
肝移植後の病態と予後に関与するRNAウイルスの探索,福原　崇介,大阪大学,2017-07-27 00:00:00,https://www.amed.go.jp/koubo/01/06/0106C_00162.html
乳児ボツリヌス症の発症を制御する腸内環境因子の探索,藤永　由佳子,金沢大学 ,2017-07-27 00:00:00,https://www.amed.go.jp/koubo/01/06/0106C_00162.html
組織局在型メモリーT細胞に着目した潜伏感染ウィルスの再活性化機構の解明,飯島　則文,医薬基盤・健康・栄養研究所,2017-07-27 00:00:00,https://www.amed.go.jp/koubo/01/06/0106C_00162.html
単一細胞分析データマイニングによるHTLV-1持続潜伏感染機構の解明,佐藤　賢文,熊本大学,2017-07-27 00:00:00,https://www.amed.go.jp/koubo/01/06/0106C_00162.html
組織前駆細胞(幹細胞)における潜伏感染・持続感染維持機構と細胞分化に伴うウイルス再活性化の分子機構の解明,田口　歩,東京都立駒込病院,2017-07-27 00:00:00,https://www.amed.go.jp/koubo/01/06/0106C_00162.html
核内複製というRNAウイルスの持続感染戦略の解明,朝長　啓造,京都大学,2017-07-27 00:00:00,https://www.amed.go.jp/koubo/01/06/0106C_00162.html
造血細胞移植をモデルとした潜伏持続感染ウイルス再活性化における免疫回避の分子機構と宿主免疫再構築,仲宗根　秀樹,自治医科大学,2017-07-27 00:00:00,https://www.amed.go.jp/koubo/01/06/0106C_00162.html
新規臨床データと革新的技術の融合で読み解くEBウイルス再活性化,村田　貴之,名古屋大学,2017-07-27 00:00:00,https://www.amed.go.jp/koubo/01/06/0106C_00162.html
エイズ動物モデルに基づくB細胞Akt制御によるウイルス中和抗体誘導の解析及びその革新的定量予測モデルの構築,山本　浩之,国立感染症研究所,2017-07-27 00:00:00,https://www.amed.go.jp/koubo/01/06/0106C_00162.html
新規治療戦略基盤創出に資する病原性原虫のPCV破壊・形成・維持に関与する宿主因子群の解明,山本　雅裕,大阪大学,2017-07-27 00:00:00,https://www.amed.go.jp/koubo/01/06/0106C_00162.html
ウイルス感染ネットワークの動的制御による持続感染の運命決定機構,渡士　幸一,国立感染症研究所,2017-07-27 00:00:00,https://www.amed.go.jp/koubo/01/06/0106C_00162.html
病原体と宿主のエネルギー代謝系の相互作用の解析―アフリカトリパノソーマによる中枢神経感染をモデルとして,城戸　康年,大分大学,2017-07-27 00:00:00,https://www.amed.go.jp/koubo/01/06/0106C_00162.html
マラリア感染における脳特異的免疫病態の解明,Coban Cevayir,大阪大学,2017-07-27 00:00:00,https://www.amed.go.jp/koubo/01/06/0106C_00162.html
構造生物学的手法による麻疹ウイルス中枢神経持続感染の治療薬創出を目指した研究,橋口　隆生,九州大学,2017-07-27 00:00:00,https://www.amed.go.jp/koubo/01/06/0106C_00162.html
ゲートウェイ反射に基づく病原体侵入口形成機構の解明,村上　正晃,北海道大学,2017-07-27 00:00:00,https://www.amed.go.jp/koubo/01/06/0106C_00162.html
病原真菌Aspergillus fumigatusの環境適応能の数理モデル化による理解とそれに基づく感染防御を目指した研究,高橋　弘喜,千葉大学,2017-07-27 00:00:00,https://www.amed.go.jp/koubo/01/06/0106C_00162.html
赤痢アメーバ“含硫脂質代謝”を標的とする阻害剤探索 -全容解明と治療薬開発にむけて-,見市　文香,佐賀大学,2017-07-27 00:00:00,https://www.amed.go.jp/koubo/01/06/0106C_00162.html
インフルエンザウイルスの宿主間伝播に関わる新規分子機構の解明,岡松　正敏,北海道大学,2017-07-27 00:00:00,https://www.amed.go.jp/koubo/01/06/0106C_00162.html
人獣共通感染症病原体アフリカ型トリパノソーマのイソクエン酸代謝：新規な宿主環境適応機構と創薬標的,稲岡　健ダニエル,長崎大学,2017-07-27 00:00:00,https://www.amed.go.jp/koubo/01/06/0106C_00162.html
薬剤耐性菌に対する新規追尾型抗菌治療法の開発,崔　龍洙,自治医科大学,2017-07-27 00:00:00,https://www.amed.go.jp/koubo/01/06/0106C_00162.html
細菌の酸化ストレス耐性を標的とした新規治療戦略の開発,澤　智裕,熊本大学,2017-07-27 00:00:00,https://www.amed.go.jp/koubo/01/06/0106C_00162.html
分子間相互作用阻害に基づく菌種特異的な増殖阻害剤の開発,中川　一路,京都大学,2017-07-27 00:00:00,https://www.amed.go.jp/koubo/01/06/0106C_00162.html
人工知能とデータ大循環によって実現する、大腸内視鏡診療の革新的転換,工藤 進英,昭和大学,2017-07-24 00:00:00,https://www.amed.go.jp/koubo/02/01/0201C_00114.html
良性小腸狭窄を治療するための内視鏡下で留置可能な自己拡張型生分解性小腸用ステントの開発・海外展開,,EAファーマ株式会社,2017-07-18 00:00:00,https://www.amed.go.jp/koubo/02/01/0201C_00127.html
SPECT-CTフュージョンアプリケーションの開発・事業化,,GEヘルスケア・ジャパン株式会社,2017-07-18 00:00:00,https://www.amed.go.jp/koubo/02/01/0201C_00127.html
内視鏡下手術を革新する「形状記憶合金製多機能鉗子」の事業化,,佐久間特殊鋼株式会社,2017-07-18 00:00:00,https://www.amed.go.jp/koubo/02/01/0201C_00127.html
立体構造が極めて複雑な先天性心疾患患者への3Dモデル診断による術時間削減を実現する、オーダーメイド型超軟質3D精密心臓モデルの開発・事業化,,株式会社クロスエフェクト,2017-07-18 00:00:00,https://www.amed.go.jp/koubo/02/01/0201C_00127.html
在宅皮膚科光線療法支援システムの開発・事業化,,株式会社インフォワード,2017-07-18 00:00:00,https://www.amed.go.jp/koubo/02/01/0201C_00127.html
世界最小最軽量の高機能次世代型心肺補助システムの開発・製品化,,ニプロ株式会社,2017-07-18 00:00:00,https://www.amed.go.jp/koubo/02/01/0201C_00127.html
老眼の悩みを解決した世界初ピンホールコンタクトレンズの開発・事業化,,株式会社ユニバーサルビュー,2017-07-18 00:00:00,https://www.amed.go.jp/koubo/02/01/0201C_00127.html
